{
  "$schema": "http://json-schema.org/draft-07/schema",
  "title": "Connector editor schema",
  "description": "Connector editor schema",
  "type": "object",

  "definitions": {
    "connector-parameters": {
      "type": "array",
      "items": {
        "type": "object",
        "additionalProperties" : false,
        "properties": {
          "id": {
            "type": "string",
            "minLength": 1
          },
          "name": {
            "type": "string",
            "minLength": 1
          },
          "description": {
            "type": "string"
          },
          "type": {
            "type": "string",
            "enum": [ "string", "integer", "boolean", "date", "json", "file" ]
          },
          "required": {
            "type": "boolean"
          }
        },
        "required": [ "id", "name", "type" ]
      }
    },
    "connector-action": {
      "type": "object",
      "additionalProperties" : false,
      "properties": {
        "id": {
          "type": "string",
          "minLength": 1
        },
        "name": {
          "type": "string",
          "minLength": 1
        },
        "description": {
          "type": "string"
        },
        "inputs": { "$ref": "#/definitions/connector-parameters" },
        "outputs": { "$ref": "#/definitions/connector-parameters" }
      },
      "required": [ "id", "name" ]
    }
  },

  "additionalProperties" : false,
  "properties": {
    "id": {
      "description": "The connector id",
      "type": "string"
    },
    "name": {
      "description": "The connector's name",
      "type": "string",
      "minLength": 1,
      "maxLength": 26,
      "pattern": "^[a-z]([-a-z0-9]{0,24}[a-z0-9])?$"
    },
    "description": {
      "description": "The connector's description",
      "type": "string"
    },
    "template": {
      "description": "The connector's template",
      "type": "string"
    },
    "actions" : {
      "type": "object",
      "additionalProperties": { "$ref": "#/definitions/connector-action" },
      "default": {}
    }
  },
  "required": [ "name" ]
}
